"","SKU PRODOTTO","ASIN LIVE AMAZON","ASIN FORNITO TENACTA","L'ASIN LIVE SU AMAZON è UGUALE ALL'ASIN FORNITO TENACTA?","NOME PRODOTTO LIVE AMAZON","LUNGHEZZA NOME PRODOTTO LIVE SU AMAZON","NOME PRODOTTO UFFICIALE FORNITO DA TENACTA","LUNGHEZZA NOME PRODOTTO FORNITO DA TENACTA","IL NOME PRODOTTO LIVE AMAZON è UGUALE AL NOME PRODOTTO UFFICIALE TENACTA?","LA LUNGHEZZA DEL NOME PRODOTTO LIVE AMAZON è UGUALE ALLA LUNGHEZZA DEL NOME UFFICIALE TENACTA?","QUESTO ASIN RICHIEDE UNA CORREZIONE"
"1","imetec scaldasonno singolo 150x80 cm, basso consumo, 50% lana e merino, 2 temperature, dispositivo sicurezza electro block, made in italy","B0056BZZDA","B0056BZZDA",TRUE,"0","1","NEED FIX","NEED FIX",137,"TRUE","NEED FIX"
"2","imetec scaldasonno matrimoniale 150x160 cm, 50% lana e merino, 2 temperature, dispositivo sicurezza electro block, made in italy","B0056C02MI","B0056C02MI",TRUE,"0","1","TRUE","TRUE",128,"TRUE","NEED FIX"
"5","imetec dolcevita es4 bilancia elettronica da cucina, pesa solidi e liquidi, contenitore estraibile, scala graduata, portata 5 kg, divisione 1 g, funzione tara, display digitale, spegnimento automatico","B00FM266R2","B00FM266R2",TRUE,"0","1","TRUE","TRUE",200,"TRUE","NEED FIX"
"6","bellissima imetec s5 2200 asciugacapelli, 2200 w, asciugatura rapida e styling a lunga durata, 8 combinazioni aria/temperatura, colpo daria fredda","B00G3DNXIE","B00G3DNXIE",TRUE,"0","1","TRUE","TRUE",146,"TRUE","NEED FIX"
"7","imetec nuvola ferro da stiro da viaggio a vapore, piastra in acciaio inossidabile da 1000 w, custodia da viaggio, doppio voltaggio","B00GLSDCS2","B00GLSDCS2",TRUE,"0","1","TRUE","TRUE",130,"TRUE","NEED FIX"
"12","bellissima imetec gh16 400 spazzola ad aria modellante con 2 accessori di styling, diametro 25 mm, potenza 400 w, 2 combinazioni flusso daria/temperatura, puntale antiscottatura","B00N4K5PDK","B00N4K5PDK",TRUE,"0","1","TRUE","TRUE",177,"TRUE","NEED FIX"
"15","bellissima imetec gt13 50 arricciacapelli, rivestimento in ceramica, 7 diversi livelli di temperatura da 150°c a 210°c, diametro di 25 mm, riscaldamento rapido, pronto alluso","B00SKVYB6K","B00SKVYB6K",TRUE,"0","1","TRUE","TRUE",174,"TRUE","NEED FIX"
"16","bellissima imetec gt15 100 arricciacapelli, ricci brillanti e definiti, diametro 19 mm, rivestimento in ceramica, riscaldamento rapido, pronto alluso","B00VRGPXF8","B00VRGPXF8",TRUE,"0","1","TRUE","TRUE",149,"TRUE","NEED FIX"
"18","bellissima imetec creativity b9 400 piastra per capelli, styling liscio o mosso, rivestimento in ceramica e cheratina, piastre arrotondate","B015O6A68K","B015O6A68K",TRUE,"0","1","TRUE","TRUE",138,"TRUE","NEED FIX"
"19","bellissima imetec p11 2300 asciugacapelli professionale, 2300 w, rivestimento in ceramica e tormalina, 8 combinazioni aria/temperatura, beccuccio stretto, diffusore capelli ricci","B015O6A6GM","B015O6A6GM",TRUE,"0","1","TRUE","TRUE",178,"TRUE","NEED FIX"
"21","imetec hb3 frullatore a immersione, gambo large estraibile, lame in acciaio inox, funzionamento a impulsi, 450 w","B01JOL22Y2","B01JOL22Y2",TRUE,"0","1","TRUE","TRUE",112,"TRUE","NEED FIX"
"22","imetec panemio macchina del pane, impasta lievita e cuoce, 12 programmi, cestello pagnotta, accessorio panini, 3 livelli di doratura, avvio programmabile, 550 w, ricettario","B01LXNKQOL","B01LXNKQOL",TRUE,"0","1","TRUE","TRUE",172,"TRUE","NEED FIX"
"24","bellissima my pro imetec beach waves gt20 100 piastra per capelli a onde larghe e strette, rivestimento in ceramica, temperatura regolabile","B06WGV3DBP","B06WGV3DBP",TRUE,"0","1","TRUE","TRUE",139,"TRUE","NEED FIX"
"26","imetec personal e sport blender pb 100 mini frullatore con 2 bottiglie take-away in tritan e 4 lame in acciaio inox, 22,000 giri/min","B0711KBY99","B0711KBY99",TRUE,"0","1","TRUE","TRUE",132,"TRUE","NEED FIX"
"27","imetec sm 1000 soup maker, cuoce e frulla, 3 programmi automatici, vellutate, zuppe e frullati, 6 porzioni, lame seghettate acciaio inox, con ricettario, 900 w, 1.6 litri","B071451JHC","B071451JHC",TRUE,"0","1","TRUE","TRUE",170,"TRUE","NEED FIX"
"30","bellissima imetec gt15 200 ferro arricciacapelli con rivestimento in ceramica, forma conica, controllo della temperatura","B075RFR2CV","B075RFR2CV",TRUE,"0","1","NEED FIX","NEED FIX",120,"TRUE","NEED FIX"
"32","imetec succovivo pro 2000 estrattore di succo professionale a freddo, spremitura lenta 48 giri/min, 2 filtri per succhi, accessorio per granite e sorbetti, kit per maschere bellezza, con ricettario","B076998CD8","B076998CD8",TRUE,"0","1","TRUE","TRUE",197,"TRUE","NEED FIX"
"33","imetec bw03 boule elettrica cordless, tecnologia ceramica, riscaldamento ultrarapido, termostato di sicurezza, spia di ricarica","B078RL1X78","B078RL1X78",TRUE,"0","1","NEED FIX","NEED FIX",127,"TRUE","NEED FIX"
"34","bellissima imetec bm 200 piastra mini per capelli lisci e luminosi, temperatura 200°, multivoltaggio automatico, dimensioni compatte da viaggio","B079FN8N4T","B079FN8N4T",TRUE,"0","1","TRUE","TRUE",143,"TRUE","NEED FIX"
"35","imetec salon expert p5 3600 asciugacapelli professionale, 2300 w, griglia con rivestimento in ceramica e cheratina, tecnologia a ioni, 8 combinazioni aria/temperatura, 2 beccucci","B079Z9GXQS","B079Z9GXQS",TRUE,"0","1","TRUE","TRUE",178,"TRUE","NEED FIX"
"36","imetec zerocalc z3 3500 ferro da stiro, tecnologia anticalcare, piastra inox 2400 w, colpo vapore 150 g","B07CKRCMB7","B07CKRCMB7",TRUE,"0","1","TRUE","TRUE",103,"TRUE","NEED FIX"
"41","imetec zerocalc z3 3700 ferro da stiro, tecnologia anticalcare, piastra ceramica ad alta scorrevolezza, 2400w, colpo vapore 160 g, 0,3 litri, dispositivo antigoccia tecnologia a risparmio energetico","B07MZGRDJ4","B07MZGRDJ4",TRUE,"0","1","TRUE","TRUE",198,"TRUE","NEED FIX"
"42","imetec zerocalc z3 3900 ferro da stiro a vapore, tecnologia anticalcare, tecnologia intellivapor (temperatura unica ideale per tutti i tessuti), piastra ceramica, 2400 w, colpo vapore 170 g","B07NYRRF1Y","B07NYRRF1Y",TRUE,"0","1","TRUE","TRUE",189,"TRUE","NEED FIX"
"43","imetec zerocalc ps1 2000 ferro da stiro compatto, 3.8 bar, tecnologia anticalcare e a risparmio energetico, ricarica continua, vapore pronto in 1 minuto, 2100 w, serbatoio xl da 1 l","B07P35DTPJ","B07P35DTPJ",TRUE,"0","1","NEED FIX","NEED FIX",181,"TRUE","NEED FIX"
"46","bellissima imetec my pro creativity infrared b8 200, piastra lisciante, tecnologia raggi infrarossi, rivestimento in ceramica e cheratina, 11 livelli di temperatura da 130 °c a 230 °c, cavo 1,8 m","B07S5L9937","B07S5L9937",TRUE,"0","1","TRUE","TRUE",195,"TRUE","NEED FIX"
"47","imetec zerocalc kf1 100 kit 3 filtri anticalcare per ferri da stiro imetec zerocalc pro ceramic ps2 2400, ps2 2000, ps2 2200, intellivapor ps3 3000, imetec onda, ricambi originali","B07S61V42S","B07S61V42S",TRUE,"0","1","TRUE","TRUE",179,"TRUE","NEED FIX"
"49","imetec body analizer es7 400 bilancia pesapersone diagnostica, misura acqua corporea, massa muscolare e grassa","B07VGH4Z81","B07VGH4Z81",TRUE,"0","1","TRUE","TRUE",110,"TRUE","NEED FIX"
"50","bellissima my pro imetec gh18 1100 modellatore ad aria, rivestimento spazzole in ceramica, 5 accessori per realizzare capelli lisci e luminosi, a onde morbide o ricci stretti, 1000 w","B07W3VJQZD","B07W3VJQZD",TRUE,"0","1","TRUE","TRUE",182,"TRUE","NEED FIX"
"52","imetec precision es13 200 bilancia pesapersone elettronica, rivela anche le minime variazioni di peso, fino a 180 kg, lcd display, vetro temperato, batterie incluse","B07WBZC85N","B07WBZC85N",TRUE,"0","1","TRUE","TRUE",164,"TRUE","NEED FIX"
"55","imetec scaldasonno adapto piazza e mezza 150 x 120 cm, tecnologia brevettata, riscaldamento rapido, temperatura costante e personalizzata, 100 % cotone, comando con 6 temperature","B07Y8FDGDQ","B07Y8FDGDQ",TRUE,"0","1","NEED FIX","NEED FIX",178,"TRUE","NEED FIX"
"56","imetec scaldasonno adapto singolo 150 x 80 cm, riscaldamento rapido, temperatura costante e personalizzata, tessuto trapuntato anallergico, comando con 6 temperature","B07Y8FZ6GJ","B07Y8FZ6GJ",TRUE,"0","1","NEED FIX","NEED FIX",165,"TRUE","NEED FIX"
"57","imetec scaldasonno adapto matrimoniale 150 x 160 cm, riscaldamento rapido, temperatura costante e personalizzata, 100% lana e merino, tessuto antiscivolo, 2 comandi separati, 6 temperature","B07Y8GCMLG","B07Y8GCMLG",TRUE,"0","1","NEED FIX","NEED FIX",188,"TRUE","NEED FIX"
"58","imetec scaldasonno adapto matrimoniale 150 x 160 cm, tecnologia brevettata, riscaldamento rapido, temperatura costante e personalizzata, 100% cotone, 2 comandi con 6 temperature","B07Y8GH4K8","B07Y8GH4K8",TRUE,"0","1","NEED FIX","NEED FIX",177,"TRUE","NEED FIX"
"59","imetec scaldasonno adapto singolo 150 x 80 cm, riscaldamento rapido, temperatura costante e personalizzata, 100% lana e merino, tessuto antiscivolo, comando con 6 temperature","B07Y8GQMP5","B07Y8GQMP5",TRUE,"0","1","NEED FIX","NEED FIX",174,"TRUE","NEED FIX"
"60","imetec scaldasonno adapto matrimoniale, 150x160, riscaldamento rapido, temperatura costante e personalizzata, tessuto trapuntato anallergico, comando con 6 temperature","B07Y8GQVND","B07Y8GQVND",TRUE,"0","1","NEED FIX","NEED FIX",167,"TRUE","NEED FIX"
"61","imetec scaldasonno adapto singolo 150 x 80 cm, tecnologia brevettata, riscaldamento rapido, temperatura costante e personalizzata, 100% cotone, comando con 6 temperature","B07Y8GR1WS","B07Y8GR1WS",TRUE,"0","1","NEED FIX","NEED FIX",169,"TRUE","NEED FIX"
"63","bellissima imetec asciugacapelli s9 2200 asciuga e modella con precisione, 2200 w, 8 combinazioni flusso daria temperatura, beccussio di precisione, colpo aria fredda","B082WSZXHB","B082WSZXHB",TRUE,"0","1","TRUE","TRUE",166,"TRUE","NEED FIX"
"64","imetec zero-glu pro, macchina per pane, ciabatte e panini senza glutine per celiaci, pasta pizza, dolci, marmellate, 20 programmi, 2 pale impastatrici, temperatura levitazione controllata, ricettario","B0848JZ6KP","B0848JZ6KP",TRUE,"0","1","TRUE","TRUE",199,"TRUE","NEED FIX"
"65","imetec scaldasonno adapto maxi coprimaterasso singolo 195x90 cm, riscaldamento rapido, temperatura costante e personalizzata, tessuto anallergico trapuntato, comando con 6 temperature","B08HR1VGSR","B08HR1VGSR",TRUE,"0","1","NEED FIX","NEED FIX",183,"TRUE","NEED FIX"
"68","imetec onda p2 ferro da stiro generatore di vapore, piastra a onde scorrevole brevettata, 2400w, colpo vapore 300 g, serbatoio 2,5l, 3 filtri con ioni di argento, tecnologia no stop vapor","B08HS61FJ5","B08HS61FJ5",TRUE,"0","1","TRUE","TRUE",187,"TRUE","NEED FIX"
"70","bellissima my pro imetec gt22 120, accessorio sculpted curls per styler arricciacapelli twist & style, ferro riscaldato da 11 mm, rivestimento in ceramica, temperatura 185°c","B08J8XCSH4","B08J8XCSH4",TRUE,"0","1","TRUE","TRUE",173,"TRUE","NEED FIX"
"72","bellissima my pro imetec twist & style gt22 100, manico per styler arricciacapelli per onde e ricci, temperatura automatica, riscaldamento rapido, orientabile a 90°, accessori non inclusi","B08J8XH5BH","B08J8XH5BH",TRUE,"0","1","TRUE","TRUE",187,"TRUE","NEED FIX"
"74","imetec scaldasonno adapto maxi coprimaterasso matrimoniale 195 x 165 cm, riscaldamento rapido, temperatura costante e personalizzata, 100% lana e merino, doppio comando, 6 temperature","B08J8XMFQN","B08J8XMFQN",TRUE,"0","1","NEED FIX","NEED FIX",183,"TRUE","NEED FIX"
"77","imetec adapto velvet square plaid riscaldabile, coperta elettrica 150x95 cm tessuto morbido, tecnologia adapto, dispositivo di sicurezza, rapido riscaldamento, 6 temperature, lavabile in lavatrice","B08J8Z15M1","B08J8Z15M1",TRUE,"0","1","NEED FIX","NEED FIX",196,"TRUE","NEED FIX"
"78","imetec adapto velvet tartan plaid riscaldabile con tasca mani e piedi, coperta elettrica 150x110 cm, tecnologia adapto, dispositivo di sicurezza, rapido riscaldamento, 6 temperature, lavabile","B08J8ZH957","B08J8ZH957",TRUE,"0","1","NEED FIX","NEED FIX",191,"TRUE","NEED FIX"
"79","imetec adapto velvet jacquard plaid riscaldabile, coperta elettrica 140x180 cm tessuto morbido, tecnologia adapto, dispositivo di sicurezza, rapido riscaldamento, 6 temperature, lavabile in lavatrice","B08J8ZLLDT","B08J8ZLLDT",TRUE,"0","1","NEED FIX","NEED FIX",199,"TRUE","NEED FIX"
"83","imetec tostamaxi tostapane, 2 fessure extralarge e pinze apribili per toast extrafarciti, 10 livelli di doratura, timer con autospegnimento, cassetto raccoglibriciole, 600 w","B08JV8L49M","B08JV8L49M",TRUE,"0","1","TRUE","TRUE",173,"TRUE","NEED FIX"
"86","imetec crea&crema sbattitore elettrico, fruste extralunghe per impasti dolci e panna montata, ganci acciaio inox per impastare, 5 velocità, funzione turbo, design ergonomico, 500 w","B08JVC7VB4","B08JVC7VB4",TRUE,"0","1","TRUE","TRUE",180,"TRUE","NEED FIX"
"92","imetec frescoaroma macina caffè e spezie, pepe, zucchero, frutta secca elettrico con lame in acciaio inox, contenitore salva-freschezza, funzionamento a impulsi, 150 w","B08NP5M6D4","B08NP5M6D4",TRUE,"0","1","TRUE","TRUE",167,"TRUE","NEED FIX"
"93","imetec frulla&trita frullatore a immersione, lame in acciaio inox, piede extra large, gambo estraibile, bicchiere graduato da 1 litro, 800 watt, 15.000 giri minuto","B08NPF5HWD","B08NPF5HWD",TRUE,"0","1","TRUE","TRUE",163,"TRUE","NEED FIX"
"96","imetec tritacompact tritatutto, lame in acciaio inox, capienza contenitore 400 ml, funzionamento a pressione, compatto, 350 w","B08NPR8QNN","B08NPR8QNN",TRUE,"0","1","TRUE","TRUE",125,"TRUE","NEED FIX"
"97","metec frullarapido, frullatore a immersione, gambo xl in acciaio, lame in acciaio inox, funzionamento a impulsi, 450 w","B08NPR9BYM","B08NPR9BYM",TRUE,"0","1","NEED FIX","NEED FIX",118,"TRUE","NEED FIX"
"101","imetec eco perfect ferro da stiro a vapore, risultati ottimi con -35% di consumo di acqua e -25% di consumo energetico, piastra con rivestimento pro ceramic, tripla protezione anticalcare, 2400 w","B08V11MR92","B08V11MR92",TRUE,"0","1","TRUE","TRUE",195,"TRUE","NEED FIX"
"104","imetec grattugissima, grattuggia elettrica per formaggio, pane e frutta secca, contenitore estraibile, coperchio salvafreschezza, 150 w, rullo in acciacio, accessori lavabili in lavastoviglie","B08XBZV29G","B08XBZV29G",TRUE,"0","1","TRUE","TRUE",191,"TRUE","NEED FIX"
"105","imetec salon expert p3 3600 asciugacapelli, motore professionale, 2200 w, ionizzatore, griglia ceramica e tormalina, 8 combinazioni aria temperatura, concentratore e diffusore professionali","B093C19CSD","B093C19CSD",TRUE,"0","1","TRUE","TRUE",189,"TRUE","NEED FIX"
"106","imetec silent power comfort, termoventilatore silenzioso e compatto, stufetta elettrica, 2100 w, 4 funzioni, termostato ambiente e di sicurezza, funzione antigelo, maniglia","B0987B62CP","B0987B62CP",TRUE,"0","1","TRUE","TRUE",172,"TRUE","NEED FIX"
"107","imetec eco ceramic diffusion, stufetta elettrica, termoventilatore, corpo oscillante, tecnologia ceramica, basso consumo energetico, 6 funzioni di temperatura, timer","B0987BBB14","B0987BBB14",TRUE,"0","1","TRUE","TRUE",165,"TRUE","NEED FIX"
"109","imetec eco ceramic, termoventilatore, stufetta elettrica, tecnologia ceramica, basso consumo energetico, silenzioso, 3 livelli di temperatura, termostato ambiente","B0987C1JFD","B0987C1JFD",TRUE,"0","1","TRUE","TRUE",162,"TRUE","NEED FIX"
"113","imetec silent power protection, termoventilatore silenzioso, 2100 w, stufetta elettrica, timer spegnimento programmabile, temperatura regolabile, 4 funzioni, termostato ambiente, funzione antigelo","B0987D9K2X","B0987D9K2X",TRUE,"0","1","TRUE","TRUE",196,"TRUE","NEED FIX"
"116","bellissima imetec creativity 4 you, asciugacapelli professionale, 4 accessori, diffusore, controllo intelligente della temperatura, ion technology, beauty bag, 2 velocità, 3 temperature, 1800 w","B09CTY5P2L","B09CTY5P2L",TRUE,"0","1","TRUE","TRUE",193,"TRUE","NEED FIX"
"117","bellissima my pro imetec gt22 150 accessorio mermaid waves per styler arricciacapelli twist&style, ferro riscaldato forma bubbles, diametro 25 mm, rivestimento in ceramica, temperatura 190°c","B09CTZ6WKM","B09CTZ6WKM",TRUE,"0","1","TRUE","TRUE",190,"TRUE","NEED FIX"
"118","imetec intellisense comfort, termoforo multiuso, cuscino termico, per schiena e addome, tasca per mani, rapido riscaldamento, tessuto anallergico, 5 temperature, electro block di sicurezza, lavabile","B09CTZF711","B09CTZF711",TRUE,"0","1","TRUE","TRUE",198,"TRUE","NEED FIX"
"119","imetec intellisense xl, termoforo extra large schiena e gambe, cuscino termico, 38x50 cm, tessuto micro peluche, 5 temperature, electro block di sicurezza, riscaldamento rapido, lavabile in lavatrice","B09CTZM9LJ","B09CTZM9LJ",TRUE,"0","1","TRUE","TRUE",199,"TRUE","NEED FIX"
"127","imetec intellisense comfort, termoforo multiuso, cuscino termico, 40x35 cm, tessuto anallergico, 5 temperature, electro block di sicurezza, lavabile, grigio, 40x35 cm","B09KV6G5KT","B09KV6G5KT",TRUE,"0","1","NEED FIX","NEED FIX",166,"TRUE","NEED FIX"
"128","imetec pro, bilancia pesapersone analogica, rileva il peso in modo chiaro e affidabile, pedana antiscivolo, portata max 150 kg, divisione 1 kg, funzionamento meccanico","B09N2JV9X3","B09N2JV9X3",TRUE,"0","1","NEED FIX","TRUE",167,"TRUE","NEED FIX"
"129","imetec intellifast, ferro da stiro a vapore, tecnologia intelli system, impostazione automatica della temperatura, piastra ceramic diamond, protezione anticalcare, 2400 w, colpo vapore 200 g","B09SDHHKJZ","B09SDHHKJZ",TRUE,"0","1","TRUE","TRUE",190,"TRUE","NEED FIX"
"132","imetec rapidvapor ferro da stiro generatore di vapore, piastra fluid ceramic a rapido riscaldamento, leggero, sistema di pulizia calc clean, colpo vapore 240 g, 2400 w, 5 bar pump","B0B1QV8TWC","B0B1QV8TWC",TRUE,"0","1","TRUE","TRUE",179,"TRUE","NEED FIX"
"134","bellissima imetec kit bellezza capelli con asciugacapelli professionale, tecnologia ceramica e cheratina e piastra lisciante a vapore, rivestimento in ceramica e cheratina","B0B9HC9HSR","B0B9HC9HSR",TRUE,"0","1","TRUE","TRUE",171,"TRUE","NEED FIX"
"135","imetec activation ferro da stiro a vapore, piastra scorrevole in ceramica e tormalina, colpo vapore 200 g, tecnologia anticalcare zerocalc, antigoccia, eco, 2400 w","B0BCPB5TYQ","B0BCPB5TYQ",TRUE,"0","1","TRUE","TRUE",163,"TRUE","NEED FIX"
"136","imetec cakelover, impastatrice planetaria per dolci, creme e impasti salati, accessoriata, compatta, 1500w, fruste, pale e ganci, contenitore inox, 5 litri, 6 velocità, ricettario","B0BDVBHWWD","B0BDVBHWWD",TRUE,"0","1","TRUE","TRUE",179,"TRUE","NEED FIX"
"137","bellissima diffon ceramic argan, diffusore ad aria calda per capelli ricci, tecnologia ceramica e argan oil, asciugatura delicata, 2 livelli aria/temperatura, 700 w","B0BFBDBJK2","B0BFBDBJK2",TRUE,"0","1","NEED FIX","NEED FIX",164,"TRUE","NEED FIX"
"138","bellissima diffon ceramic argan, diffusore ad aria calda per capelli ricci, tecnologia ceramica e argan oil, asciugatura delicata, 2 livelli aria/temperatura, 700 w","B0BFBDBJK2","B0BFBDBJK2",TRUE,"0","1","NEED FIX","NEED FIX",164,"TRUE","NEED FIX"
"141","bellissima twist&style arricciacapelli, manico + 4 accessori per ricci e onde, temperatura automatica, riscaldamento rapido, rivestimento in ceramica, orientabile a 90°","B0BFGMJSV6","B0BFGMJSV6",TRUE,"0","1","NEED FIX","NEED FIX",168,"TRUE","NEED FIX"
"142","imetec adapto elegance, plaid riscaldabile, coperta elettrica, 180x140 cm tessuto morbido, risparmio energetico, tecnologia adapto, rapido riscaldamento, 6 temperature, lavabile, beige","B0BLCXY3J8","B0BLCXY3J8",TRUE,"0","1","NEED FIX","NEED FIX",184,"TRUE","NEED FIX"
"143","imetec adapto grand luxe, plaid riscaldabile, coperta elettrica, 180x140 cm tessuto morbido, risparmio energetico, tecnologia adapto, rapido riscaldamento, 6 temperature, lavabile, grigio","B0BLCZ42BG","B0BLCZ42BG",TRUE,"0","1","NEED FIX","NEED FIX",187,"TRUE","NEED FIX"
