"123","imetec frullarapido+, frullatore a immersione, gambo xl in acciaio, lame in acciaio inox, funzionamento a impulsi, bicchiere graduato da 700 ml bpa free, 800 w","B09CYM6KR3","B09CYM6KR3",TRUE,"imetec frullarapido+, frullatore a immersione, gambo xl in acciaio, lame in acciaio inox, funzionamento a impulsi, bicchiere graduato da 700 ml bpa free, 800 w",159,"TRUE","TRUE",159,"TRUE","NEED FIX"
"124","imetec scaldasonno adapto maxi coprimaterasso matrimoniale 195x165 cm, riscaldamento rapido, temperatura costante e personalizzata, 100% cotone percalle trapuntato, doppio comando, 6 temperature","B09GTTY863","B09GTTY863",TRUE,"imetec scaldasonno adapto maxi coprimaterasso matrimoniale 195x165 cm, basso consumo, riscaldamento rapido, temperatura personalizzata, 100% cotone percalle trapuntato, doppio comando, 6 temperature",198,"NEED FIX","NEED FIX",194,"TRUE","NEED FIX"
"128","imetec pro, bilancia pesapersone analogica, rileva il peso in modo chiaro e affidabile, pedana antiscivolo, portata max 150 kg, divisione 1 kg, funzionamento meccanico","B09N2JV9X3","B09N2JV9X3",TRUE,"imetec pro, bilancia pesapersone meccanica, rileva il peso in modo chiaro e affidabile, pedana antiscivolo, portata max 150 kg, divisione 1 kg",142,"NEED FIX","NEED FIX",167,"TRUE","NEED FIX"
"129","imetec intellifast, ferro da stiro a vapore, tecnologia intelli system, impostazione automatica della temperatura, piastra ceramic diamond, protezione anticalcare, 2400 w, colpo vapore 200 g","B09SDHHKJZ","B09SDHHKJZ",TRUE,"imetec intellifast, ferro da stiro a vapore, tecnologia intelli system, impostazione automatica della temperatura, piastra ceramic diamond, protezione anticalcare, 2400 w, colpo vapore 200 g",190,"TRUE","TRUE",190,"TRUE","NEED FIX"
"130","bellissima imetec diffon supreme, diffusore ad aria calda per capelli ricci, diffusore xl con 12 dita, tecnologia ceramica&argan oil, 2 velocità, 3 temperature, ionizzatore, asciugatura delicata","B09SGB55N4","B09SGB55N4",TRUE,"bellissima imetec diffon supreme, diffusore ad aria calda per capelli ricci, diffusore xl con 12 dita, tecnologia ceramica&argan oil, 2 velocità, 3 temperature, ionizzatore, asciugatura delicata",194,"TRUE","TRUE",194,"TRUE","NEED FIX"
"136","imetec cakelover, impastatrice planetaria per dolci, creme e impasti salati, accessoriata, compatta, 1500w, fruste, pale e ganci, contenitore inox, 5 litri, 6 velocità, ricettario","B0BDVBHWWD","B0BDVBHWWD",TRUE,"imetec cakelover, impastatrice planetaria per dolci, creme e impasti salati, accessoriata, compatta, 1500w, fruste, pale e ganci, contenitore inox, 5 litri, 6 velocità, ricettario",179,"TRUE","TRUE",179,"TRUE","NEED FIX"
"141","bellissima twist&style arricciacapelli, manico + 4 accessori per ricci e onde, temperatura automatica, riscaldamento rapido, rivestimento in ceramica, orientabile a 90°","B0BFGMJSV6","B0BFGMJSV6",TRUE,"bellissima twist&style arricciacapelli, manico + 4 accessori per ricci e onde, temperatura automatica, riscaldamento rapido, rivestimento in ceramica, orientabile a 90°, idea regalo",181,"NEED FIX","NEED FIX",168,"TRUE","NEED FIX"
"142","imetec adapto elegance, plaid riscaldabile, coperta elettrica, 180x140 cm tessuto morbido, risparmio energetico, tecnologia adapto, rapido riscaldamento, 6 temperature, lavabile, beige","B0BLCXY3J8","B0BLCXY3J8",TRUE,"imetec adapto elegance, plaid riscaldabile, coperta elettrica, 180x140 cm tessuto morbido, risparmio energetico, tecnologia adapto, rapido riscaldamento, 6 temperature, lavabile, beige, 16936",191,"NEED FIX","NEED FIX",184,"TRUE","NEED FIX"
